{
  "availability_policy": "Never use release labels, schedule, retrieval claims or registration windows as publication timestamps.",
  "historical_evidence_sha256": "2be656a750af2d65f992c83512c9e10b9dc80b04b693a8883fb31f619af87c5d",
  "inventory_scope": [
    "data/raw/plvr/phase2c",
    "artifacts",
    ".local/plvr",
    "workspace root"
  ],
  "releases": [
    {
      "accepted_row_count": null,
      "archive_sha256": "78709904860e860f1cede4eacd52b5d97f1dac2c1f49fe68a465ad727de317b2",
      "availability_evidence": null,
      "catalog_url": "https://data.gov.tw/dataset/25119",
      "declared_archive_bytes": 1388987,
      "effective_data_period": {
        "basis": "registration window for existing sales; not transaction or publication time",
        "description": "資料內容：登記日期 115年7月21日至 115年7月31日之買賣案件，及訂約日期 115年6月21日至 115年6月30日之租賃案件，及交易日期115年6月21日至 115年6月30日之預售屋案件"
      },
      "historical_source_status": "FOUND_AUTHORITATIVE",
      "import_batch_id": null,
      "local_archive_filename": "current-20260811.zip",
      "members": [],
      "original_archive_filename": "current-20260811.zip",
      "parser_version": null,
      "publication_date": null,
      "publication_precision": "unknown",
      "raw_row_count": null,
      "recovery_reason": "no_local_bytes_in_declared_inventory_locations",
      "recovery_status": "MISSING",
      "rejected_row_count": null,
      "release_kind": "current",
      "release_label": "20260811",
      "remote_recoverability": "UNKNOWN",
      "retrieval_evidence_status": "inherited_metadata_not_reverified_bytes",
      "retrieved_at": "2026-08-11T08:50:07.056314+00:00",
      "source_dataset_id": "moi-plvr-existing-sale-main-25119",
      "source_release_available_at": null,
      "source_release_id": "moi-plvr-sale-current-20260811",
      "source_url": "https://plvr.land.moi.gov.tw/opendata/lvr_landAcsv.zip",
      "status": "metadata_only",
      "supersedes_release_id": null,
      "supersession_evidence": null,
      "transform_version": null
    },
    {
      "accepted_row_count": null,
      "archive_sha256": "e4b86047e6a98701ea28c3e639f377fc51930b8c4375c1f90227934ba7011ec2",
      "availability_evidence": null,
      "catalog_url": "https://data.gov.tw/dataset/25119",
      "declared_archive_bytes": 14661814,
      "effective_data_period": {
        "basis": "registration window for existing sales; not transaction or publication time",
        "description": "資料內容：登記日期 115年6月11日至 115年6月20日之買賣案件，及訂約日期 115年5月11日至 115年5月20日之租賃案件，及交易日期115年5月11日至 115年5月20日之預售屋案件"
      },
      "historical_source_status": "PARTIAL_AUTHORITATIVE",
      "import_batch_id": null,
      "local_archive_filename": "history-20260701.zip",
      "members": [],
      "original_archive_filename": "opendata.zip",
      "parser_version": null,
      "publication_date": null,
      "publication_precision": "unknown",
      "raw_row_count": null,
      "recovery_reason": "no_local_bytes_in_declared_inventory_locations",
      "recovery_status": "MISSING",
      "rejected_row_count": null,
      "release_kind": "history",
      "release_label": "20260701",
      "remote_recoverability": "UNKNOWN",
      "retrieval_evidence_status": "inherited_metadata_not_reverified_bytes",
      "retrieved_at": "2026-08-11T08:55:59.115153+00:00",
      "source_dataset_id": "moi-plvr-existing-sale-main-25119",
      "source_release_available_at": null,
      "source_release_id": "moi-plvr-sale-history-20260701",
      "source_url": "https://plvr.land.moi.gov.tw/DownloadHistory?type=history&fileName=20260701",
      "status": "metadata_only",
      "supersedes_release_id": null,
      "supersession_evidence": null,
      "transform_version": null
    },
    {
      "accepted_row_count": null,
      "archive_sha256": "e12f0dda5cab5c9563aedc48b5fad5ef394c6d4f695c0ad5eee971bc2bf4d5f7",
      "availability_evidence": null,
      "catalog_url": "https://data.gov.tw/dataset/25119",
      "declared_archive_bytes": 16324679,
      "effective_data_period": {
        "basis": "registration window for existing sales; not transaction or publication time",
        "description": "資料內容：登記日期 115年6月21日至 115年6月30日之買賣案件，及訂約日期 115年5月21日至 115年5月31日之租賃案件，及交易日期115年5月21日至 115年5月31日之預售屋案件"
      },
      "historical_source_status": "PARTIAL_AUTHORITATIVE",
      "import_batch_id": null,
      "local_archive_filename": "history-20260711.zip",
      "members": [],
      "original_archive_filename": "opendata.zip",
      "parser_version": null,
      "publication_date": null,
      "publication_precision": "unknown",
      "raw_row_count": null,
      "recovery_reason": "no_local_bytes_in_declared_inventory_locations",
      "recovery_status": "MISSING",
      "rejected_row_count": null,
      "release_kind": "history",
      "release_label": "20260711",
      "remote_recoverability": "UNKNOWN",
      "retrieval_evidence_status": "inherited_metadata_not_reverified_bytes",
      "retrieved_at": "2026-08-11T08:55:59.115153+00:00",
      "source_dataset_id": "moi-plvr-existing-sale-main-25119",
      "source_release_available_at": null,
      "source_release_id": "moi-plvr-sale-history-20260711",
      "source_url": "https://plvr.land.moi.gov.tw/DownloadHistory?type=history&fileName=20260711",
      "status": "metadata_only",
      "supersedes_release_id": null,
      "supersession_evidence": null,
      "transform_version": null
    },
    {
      "accepted_row_count": null,
      "archive_sha256": "dda48a0c507983e1247108f4b98e9c5e9f2c86034f858f51d8b5ca8797dbd88d",
      "availability_evidence": null,
      "catalog_url": "https://data.gov.tw/dataset/25119",
      "declared_archive_bytes": 16233603,
      "effective_data_period": {
        "basis": "registration window for existing sales; not transaction or publication time",
        "description": "資料內容：登記日期 115年7月1日至 115年7月10日之買賣案件，及訂約日期 115年6月1日至 115年6月10日之租賃案件，及交易日期115年6月1日至 115年6月10日之預售屋案件"
      },
      "historical_source_status": "PARTIAL_AUTHORITATIVE",
      "import_batch_id": null,
      "local_archive_filename": "history-20260721.zip",
      "members": [],
      "original_archive_filename": "opendata.zip",
      "parser_version": null,
      "publication_date": null,
      "publication_precision": "unknown",
      "raw_row_count": null,
      "recovery_reason": "no_local_bytes_in_declared_inventory_locations",
      "recovery_status": "MISSING",
      "rejected_row_count": null,
      "release_kind": "history",
      "release_label": "20260721",
      "remote_recoverability": "UNKNOWN",
      "retrieval_evidence_status": "inherited_metadata_not_reverified_bytes",
      "retrieved_at": "2026-08-11T08:55:59.115153+00:00",
      "source_dataset_id": "moi-plvr-existing-sale-main-25119",
      "source_release_available_at": null,
      "source_release_id": "moi-plvr-sale-history-20260721",
      "source_url": "https://plvr.land.moi.gov.tw/DownloadHistory?type=history&fileName=20260721",
      "status": "metadata_only",
      "supersedes_release_id": null,
      "supersession_evidence": null,
      "transform_version": null
    },
    {
      "accepted_row_count": null,
      "archive_sha256": "972056a2265faa30b34750ff3a68223a60c79c41ec1930519270203e95eb3228",
      "availability_evidence": null,
      "catalog_url": "https://data.gov.tw/dataset/25119",
      "declared_archive_bytes": 14505303,
      "effective_data_period": {
        "basis": "registration window for existing sales; not transaction or publication time",
        "description": "資料內容：登記日期 115年7月11日至 115年7月20日之買賣案件，及訂約日期 115年6月11日至 115年6月20日之租賃案件，及交易日期115年6月11日至 115年6月20日之預售屋案件"
      },
      "historical_source_status": "FOUND_AUTHORITATIVE",
      "import_batch_id": null,
      "local_archive_filename": "history-20260801.zip",
      "members": [],
      "original_archive_filename": "opendata.zip",
      "parser_version": null,
      "publication_date": null,
      "publication_precision": "unknown",
      "raw_row_count": null,
      "recovery_reason": "no_local_bytes_in_declared_inventory_locations",
      "recovery_status": "MISSING",
      "rejected_row_count": null,
      "release_kind": "history",
      "release_label": "20260801",
      "remote_recoverability": "UNKNOWN",
      "retrieval_evidence_status": "inherited_metadata_not_reverified_bytes",
      "retrieved_at": "2026-08-11T08:50:07.056314+00:00",
      "source_dataset_id": "moi-plvr-existing-sale-main-25119",
      "source_release_available_at": null,
      "source_release_id": "moi-plvr-sale-history-20260801",
      "source_url": "https://plvr.land.moi.gov.tw/DownloadHistory?type=history&fileName=20260801",
      "status": "metadata_only",
      "supersedes_release_id": null,
      "supersession_evidence": null,
      "transform_version": null
    },
    {
      "accepted_row_count": null,
      "archive_sha256": "4d9fa7be16bc9aba99e79c0f86ca27b32f46755de04e98e1dd2c8d8297b466c1",
      "availability_evidence": null,
      "catalog_url": "https://data.gov.tw/dataset/25119",
      "declared_archive_bytes": 14876099,
      "effective_data_period": {
        "basis": "registration window for existing sales; not transaction or publication time",
        "description": "資料內容：登記日期自 112年6月11 至 112年9月10日之買賣案件，申報日期自 112年5月11 至 112年8月10日之租賃案件，及交易日期自112年5月11 至 112年8月10日之預售屋案件"
      },
      "historical_source_status": "FOUND_AUTHORITATIVE",
      "import_batch_id": null,
      "local_archive_filename": "season-112S3.zip",
      "members": [],
      "original_archive_filename": "lvr_landcsv.zip",
      "parser_version": null,
      "publication_date": null,
      "publication_precision": "unknown",
      "raw_row_count": null,
      "recovery_reason": "no_local_bytes_in_declared_inventory_locations",
      "recovery_status": "MISSING",
      "rejected_row_count": null,
      "release_kind": "season",
      "release_label": "112S3",
      "remote_recoverability": "UNKNOWN",
      "retrieval_evidence_status": "inherited_metadata_not_reverified_bytes",